{
  "schema_version": "4.0.0",
  "entry_id": "BeH2_ccpvdz_PAR_HEA_v4_tapered__sha256_ad4e2ee8ea362794",
  "created_utc": "2026-05-14T20:26:21.641818+00:00",
  "problem": {
    "name": "BeH2",
    "basis": "cc-pvdz",
    "variant": "default",
    "charge": 0,
    "spin": 0,
    "geometry": "H 0.0 0.0 -1.30; Be 0.0 0.0 0.0; H 0.0 0.0 1.30",
    "active_space": {
      "num_electrons": 4,
      "num_spatial_orbitals": 4,
      "method": "casci",
      "frozen_core": false
    },
    "orbital_optimization": "hf"
  },
  "encoding": {
    "mapping": "parity",
    "ansatz_type": "hea",
    "ansatz_reps": 2,
    "tapering": {
      "enabled": true,
      "method": "z2_symmetry",
      "num_symmetries": 5,
      "original_num_qubits": 8,
      "tapered_num_qubits": 3,
      "sectors": [
        1,
        1,
        1,
        1,
        1
      ],
      "hf_tapered_state": [
        1,
        1,
        0
      ],
      "bk_constant_correction_ha": null,
      "bk_imaginary_stripped": false,
      "bk_max_imaginary_abs_ha": null
    }
  },
  "artifacts": {
    "qubit_hamiltonian": {
      "num_qubits": 3,
      "num_pauli_terms": 20,
      "pauli_terms": [
        {
          "pauli_string": "I",
          "coefficient": -14.49477661824352
        },
        {
          "pauli_string": "Z0Z1Z2",
          "coefficient": 0.09072118762707386
        },
        {
          "pauli_string": "Z0",
          "coefficient": 0.505710052933564
        },
        {
          "pauli_string": "Z1Z2",
          "coefficient": 0.5074246613219147
        },
        {
          "pauli_string": "Z1",
          "coefficient": 0.4732233827547424
        },
        {
          "pauli_string": "Z0Z2",
          "coefficient": 0.5074246613219151
        },
        {
          "pauli_string": "Z2",
          "coefficient": 0.09072118762707414
        },
        {
          "pauli_string": "Z0Z1",
          "coefficient": 0.5406893864605841
        },
        {
          "pauli_string": "Y0Y1",
          "coefficient": 0.08194928483331367
        },
        {
          "pauli_string": "X0X1",
          "coefficient": 0.08194928483331367
        },
        {
          "pauli_string": "Y0Y2",
          "coefficient": 0.01376127420421774
        },
        {
          "pauli_string": "X0X2",
          "coefficient": 0.01376127420421774
        },
        {
          "pauli_string": "X0Z1Z2",
          "coefficient": -0.013761274204217704
        },
        {
          "pauli_string": "X0",
          "coefficient": 0.013761274204217704
        },
        {
          "pauli_string": "Y1Y2",
          "coefficient": 0.00471286162762399
        },
        {
          "pauli_string": "X1X2",
          "coefficient": 0.00471286162762399
        },
        {
          "pauli_string": "Z0X1Z2",
          "coefficient": -0.004712861627623984
        },
        {
          "pauli_string": "X1",
          "coefficient": 0.004712861627623984
        },
        {
          "pauli_string": "Z0Z1X2",
          "coefficient": -0.0069609642501395905
        },
        {
          "pauli_string": "X2",
          "coefficient": 0.0069609642501395905
        }
      ],
      "is_tapered": true,
      "framework": "pennylane"
    },
    "circuits": {
      "hf_state": [
        1,
        1,
        0
      ],
      "ansatz_pennylane": null,
      "ansatz_includes_hf": true
    }
  },
  "results": {
    "reference": {
      "hf_energy_hartree": -15.766427614860927,
      "casci_ground_energy_hartree": -15.768410988000937,
      "casci_first_excited_hartree": -15.505738578615679,
      "casscf_energy_hartree": null,
      "exact_qubit_ground_energy_hartree": -15.768410988000921
    },
    "classical_comparison": {
      "hf_energy_hartree": -15.766427614860927,
      "mp2_energy_hartree": -15.818302820733463,
      "ccsd_energy_hartree": -15.834959025960277,
      "ccsd_t_energy_hartree": -15.835391011974103,
      "mp2_correlation": -0.0518752058725358,
      "ccsd_t_correlation": -0.06896339711317623,
      "pyscf_version": "2.6.2",
      "computed_utc": "2026-05-14T20:25:37.104249+00:00",
      "basis": "cc-pvdz"
    },
    "vqe": {
      "best_energy_hartree": -15.768410948332045,
      "optimal_params": [
        2.0776379555150717,
        0.5350716111698905,
        3.6244950337325674,
        1.7617355233423533,
        -1.5279763046943031,
        1.7979543222581402,
        1.0793102224968139,
        1.1558725867787432,
        -2.6543772890050614
      ],
      "num_params": 9,
      "nfev": 3918,
      "optimizer": "COBYLA",
      "multistart_runs": 10,
      "computed_utc": "2026-05-14T20:26:21.641644+00:00"
    },
    "quality": {
      "gap_threshold": 0.01,
      "trusted": true,
      "abs_vqe_exact_gap": 3.966887618389592e-08,
      "beats_classical": true,
      "flags": [
        "gap_certified",
        "beats_classical"
      ],
      "notes": null,
      "gap_reference": "exact_qubit_hamiltonian",
      "beats_classical_definition": "abs_vqe_exact_gap < |CCSD(T) correlation energy|; the VQE error is smaller than the total correlation energy CCSD(T) recovers. NOT a claim that VQE outperforms classical methods."
    }
  },
  "provenance": {
    "entry_hash_sha256": "ad4e2ee8ea3627944bdcda943f6352da195996ec61a8160bd52d50b8f1e1d9dd",
    "source_schema_version": "4.0.0",
    "created_utc": "2026-05-14T20:26:21.641818+00:00",
    "tool_versions": {
      "python": "3.11.15",
      "pyscf": "2.6.2",
      "pennylane": "0.45.0",
      "openfermion": "1.6.1",
      "numpy": "2.2.6",
      "scipy": "1.13.1",
      "git_commit": "e7aa8b4"
    },
    "environment": {
      "platform": "linux"
    }
  },
  "trust": {
    "level": "certified",
    "certified_utc": "2026-05-14T20:26:21.641818+00:00",
    "signature_b64": null,
    "signing_key_id": null
  },
  "run_config": {
    "optimizer": "COBYLA",
    "max_iterations": 500,
    "multistart": 10,
    "seed": 42,
    "backend_type": "default.qubit",
    "shots": null
  },
  "circuit_stats": {
    "num_qubits_original": 8,
    "num_qubits_tapered": 3,
    "ansatz_num_parameters": 9,
    "ansatz_depth": 8,
    "ansatz_num_2q_gates": 4,
    "ansatz_num_1q_gates": 9,
    "non_clifford_gate_count": 9,
    "t_gate_estimate": 108,
    "t_gate_synthesis_epsilon": 0.001
  }
}