{
  "schema_version": "4.0.0",
  "entry_id": "HF_ccpvdz_BK_HEA_v4_tapered__sha256_0d0d66a5769d58ec",
  "created_utc": "2026-07-15T13:22:32.274462+00:00",
  "problem": {
    "name": "HF",
    "basis": "cc-pvdz",
    "variant": "default",
    "charge": 0,
    "spin": 0,
    "geometry": "H 0.0 0.0 0.0; F 0.0 0.0 0.917",
    "active_space": {
      "num_electrons": 2,
      "num_spatial_orbitals": 2,
      "method": "casci",
      "frozen_core": false
    },
    "orbital_optimization": "hf"
  },
  "encoding": {
    "mapping": "bravyi_kitaev",
    "ansatz_type": "hea",
    "ansatz_reps": 2,
    "adapt_metadata": null,
    "tapering": {
      "enabled": true,
      "method": "z2_symmetry",
      "num_symmetries": 3,
      "original_num_qubits": 4,
      "tapered_num_qubits": 1,
      "sectors": [
        -1,
        -1,
        1
      ],
      "hf_tapered_state": [
        1
      ],
      "bk_constant_correction_ha": -0.4428668229748496,
      "bk_imaginary_stripped": false,
      "bk_max_imaginary_abs_ha": null
    }
  },
  "artifacts": {
    "qubit_hamiltonian": {
      "num_qubits": 1,
      "num_pauli_terms": 2,
      "pauli_terms": [
        {
          "pauli_string": "I",
          "coefficient": -99.56653371108361
        },
        {
          "pauli_string": "X0",
          "coefficient": 0.010082262175007973
        }
      ],
      "is_tapered": true,
      "framework": "pennylane"
    },
    "circuits": {
      "hf_state": [
        1
      ],
      "ansatz_pennylane": null,
      "ansatz_includes_hf": true
    }
  },
  "results": {
    "reference": {
      "hf_energy_hartree": -100.01941126917356,
      "casci_ground_energy_hartree": -100.01948279623346,
      "exact_qubit_ground_energy_hartree": -100.01948279623346,
      "casci_first_excited_hartree": -99.57661597325865,
      "casscf_energy_hartree": null
    },
    "classical_comparison": {
      "hf_energy_hartree": -100.01941126917356,
      "mp2_energy_hartree": -100.22319317988966,
      "ccsd_energy_hartree": -100.22815495635462,
      "ccsd_t_energy_hartree": -100.23009134571582,
      "mp2_correlation": -0.20378191071610274,
      "ccsd_t_correlation": -0.2106800765422605,
      "pyscf_version": "2.6.2",
      "computed_utc": "2026-07-15T13:22:31.741241+00:00",
      "basis": "cc-pvdz"
    },
    "vqe": {
      "best_energy_hartree": -100.01948279622955,
      "optimal_params": [
        2.68791993708617,
        2.1821458126443,
        2.983943624734032
      ],
      "num_params": 3,
      "nfev": 407,
      "optimizer": "COBYLA",
      "multistart_runs": 10,
      "computed_utc": "2026-07-15T13:22:32.274412+00:00"
    },
    "quality": {
      "gap_threshold": 0.01,
      "trusted": true,
      "abs_vqe_exact_gap": 3.907985046680551e-12,
      "gap_reference": "exact_qubit_hamiltonian",
      "beats_classical": true,
      "beats_classical_definition": "abs_vqe_exact_gap < |CCSD(T) correlation energy|; i.e. the VQE error is smaller than the total correlation energy CCSD(T) recovers. NOT a claim that VQE outperforms classical methods.",
      "flags": [
        "gap_certified",
        "beats_classical"
      ],
      "notes": null
    }
  },
  "provenance": {
    "entry_hash_sha256": "0d0d66a5769d58ec356b181ce782af4a23836327454b3639ff8e084b24d1d229",
    "source_schema_version": "4.0.0",
    "created_utc": "2026-07-15T13:22:32.274462+00:00",
    "tool_versions": {
      "python": "3.11.15",
      "pyscf": "2.6.2",
      "pennylane": "0.45.0",
      "openfermion": "1.6.1",
      "numpy": "2.2.6",
      "scipy": "1.13.1",
      "git_commit": "e1f44cd"
    },
    "hamiltonian_source": "of_bridge",
    "environment": {
      "platform": "linux",
      "blas_threads": "1",
      "threads_pinned": true
    }
  },
  "trust": {
    "level": "certified",
    "certified_utc": "2026-07-15T13:22:32.274462+00:00",
    "signature_b64": null,
    "signing_key_id": null
  },
  "run_config": {
    "optimizer": "COBYLA",
    "max_iterations": 500,
    "multistart": 10,
    "multistart_requested": 10,
    "early_stopped": false,
    "seed": 42,
    "backend_type": "default.qubit",
    "shots": null
  },
  "circuit_stats": {
    "num_qubits_original": 4,
    "num_qubits_tapered": 1,
    "ansatz_num_parameters": 3,
    "ansatz_depth": 4,
    "ansatz_num_2q_gates": 0,
    "ansatz_num_1q_gates": 4,
    "non_clifford_gate_count": 3,
    "t_gate_estimate": 36,
    "t_gate_synthesis_epsilon": 0.001
  }
}