{
  "schema_version": "4.0.0",
  "entry_id": "BeH2_ccpvdz_JW_UCCSD_v4_tapered__sha256_31f7be8f2f7d9f00",
  "created_utc": "2026-07-15T13:20:22.330397+00:00",
  "problem": {
    "name": "BeH2",
    "basis": "cc-pvdz",
    "variant": "default",
    "charge": 0,
    "spin": 0,
    "geometry": "H 0.0 0.0 -1.30; Be 0.0 0.0 0.0; H 0.0 0.0 1.30",
    "active_space": {
      "num_electrons": 4,
      "num_spatial_orbitals": 4,
      "method": "casci",
      "frozen_core": false
    },
    "orbital_optimization": "hf"
  },
  "encoding": {
    "mapping": "jordan_wigner",
    "ansatz_type": "uccsd_tapered",
    "ansatz_reps": 1,
    "adapt_metadata": null,
    "tapering": {
      "enabled": true,
      "method": "z2_symmetry",
      "num_symmetries": 5,
      "original_num_qubits": 8,
      "tapered_num_qubits": 3,
      "sectors": [
        1,
        1,
        1,
        1,
        1
      ],
      "hf_tapered_state": [
        1,
        1,
        0
      ],
      "bk_constant_correction_ha": null,
      "bk_imaginary_stripped": false,
      "bk_max_imaginary_abs_ha": null
    }
  },
  "artifacts": {
    "qubit_hamiltonian": {
      "num_qubits": 3,
      "num_pauli_terms": 20,
      "pauli_terms": [
        {
          "pauli_string": "I",
          "coefficient": -14.494776618243476
        },
        {
          "pauli_string": "Z0Z1Z2",
          "coefficient": 0.09072118762707582
        },
        {
          "pauli_string": "Z2",
          "coefficient": 0.09072118762707544
        },
        {
          "pauli_string": "Z0Z1",
          "coefficient": 0.5406893864605825
        },
        {
          "pauli_string": "Z1",
          "coefficient": 0.4732233827547462
        },
        {
          "pauli_string": "Z0Z2",
          "coefficient": 0.5074246613219132
        },
        {
          "pauli_string": "Z1Z2",
          "coefficient": 0.5074246613219129
        },
        {
          "pauli_string": "Z0",
          "coefficient": 0.5057100529335679
        },
        {
          "pauli_string": "Y0Y1",
          "coefficient": 0.08194928483331364
        },
        {
          "pauli_string": "X0X1",
          "coefficient": 0.08194928483331364
        },
        {
          "pauli_string": "Y0Y2",
          "coefficient": 0.01376127420421758
        },
        {
          "pauli_string": "X0X2",
          "coefficient": 0.01376127420421758
        },
        {
          "pauli_string": "X0Z1Z2",
          "coefficient": -0.01376127420421763
        },
        {
          "pauli_string": "X0",
          "coefficient": 0.01376127420421763
        },
        {
          "pauli_string": "Y1Y2",
          "coefficient": 0.004712861627623955
        },
        {
          "pauli_string": "X1X2",
          "coefficient": 0.004712861627623955
        },
        {
          "pauli_string": "Z0X1Z2",
          "coefficient": -0.004712861627623966
        },
        {
          "pauli_string": "X1",
          "coefficient": 0.004712861627623966
        },
        {
          "pauli_string": "Z0Z1X2",
          "coefficient": -0.006960964250139583
        },
        {
          "pauli_string": "X2",
          "coefficient": 0.006960964250139583
        }
      ],
      "is_tapered": true,
      "framework": "pennylane"
    },
    "circuits": {
      "hf_state": [
        1,
        1,
        0
      ],
      "ansatz_pennylane": null,
      "ansatz_includes_hf": true
    }
  },
  "results": {
    "reference": {
      "hf_energy_hartree": -15.766427614860913,
      "casci_ground_energy_hartree": -15.768410988000909,
      "exact_qubit_ground_energy_hartree": -15.768410988000882,
      "casci_first_excited_hartree": -15.505738578615647,
      "casscf_energy_hartree": null
    },
    "classical_comparison": {
      "hf_energy_hartree": -15.766427614860913,
      "mp2_energy_hartree": -15.818302820733445,
      "ccsd_energy_hartree": -15.83495902596026,
      "ccsd_t_energy_hartree": -15.835391011974085,
      "mp2_correlation": -0.05187520587253225,
      "ccsd_t_correlation": -0.06896339711317268,
      "pyscf_version": "2.6.2",
      "computed_utc": "2026-07-15T13:20:18.668388+00:00",
      "basis": "cc-pvdz"
    },
    "vqe": {
      "best_energy_hartree": -15.768404341882142,
      "optimal_params": [
        0.011587309668483987,
        -0.005239379972526589,
        0.011239479787682312,
        0.023550120020605782,
        -0.01627644830928628,
        -0.01889418155270893,
        0.009897221190424028,
        -0.02850647734665606
      ],
      "num_params": 8,
      "nfev": 272,
      "optimizer": "COBYLA",
      "multistart_runs": 1,
      "computed_utc": "2026-07-15T13:20:22.330283+00:00"
    },
    "quality": {
      "gap_threshold": 0.01,
      "trusted": true,
      "abs_vqe_exact_gap": 6.646118739794815e-06,
      "gap_reference": "exact_qubit_hamiltonian",
      "beats_classical": true,
      "beats_classical_definition": "abs_vqe_exact_gap < |CCSD(T) correlation energy|; i.e. the VQE error is smaller than the total correlation energy CCSD(T) recovers. NOT a claim that VQE outperforms classical methods.",
      "flags": [
        "gap_certified",
        "beats_classical"
      ],
      "notes": null
    }
  },
  "provenance": {
    "entry_hash_sha256": "31f7be8f2f7d9f008f5e8fa13d9eb66df388d1ee38cfdf22dd13b4b7acfd78f9",
    "source_schema_version": "4.0.0",
    "created_utc": "2026-07-15T13:20:22.330397+00:00",
    "tool_versions": {
      "python": "3.11.15",
      "pyscf": "2.6.2",
      "pennylane": "0.45.0",
      "openfermion": "1.6.1",
      "numpy": "2.2.6",
      "scipy": "1.13.1",
      "git_commit": "e1f44cd"
    },
    "hamiltonian_source": "of_bridge",
    "environment": {
      "platform": "linux",
      "blas_threads": "1",
      "threads_pinned": true
    }
  },
  "trust": {
    "level": "certified",
    "certified_utc": "2026-07-15T13:20:22.330397+00:00",
    "signature_b64": "sQClXmLrP+df7kbgph6WjN6SQCa1+cWrHOGgi/qoJ/CUsQEROAuv1VZoLECOxL7u2DMFsKo2WgDLlBlmd36WBA==",
    "signing_key_id": "ed25519:85d603a74774d0ac"
  },
  "run_config": {
    "optimizer": "COBYLA",
    "max_iterations": 500,
    "multistart": 1,
    "multistart_requested": 10,
    "early_stopped": true,
    "seed": 42,
    "backend_type": "default.qubit",
    "shots": null
  },
  "circuit_stats": {
    "num_qubits_original": 8,
    "num_qubits_tapered": 3,
    "ansatz_num_parameters": 8,
    "ansatz_depth": 14,
    "ansatz_num_2q_gates": 8,
    "ansatz_num_1q_gates": 2,
    "non_clifford_gate_count": 14,
    "t_gate_estimate": 168,
    "t_gate_synthesis_epsilon": 0.001
  }
}